course_tag,course_name,course_distribs,course_core,description
CS 331,Advanced Algorithm Design,MM,False,"Explore advanced topics in the design and analysis of algorithms and data structures. The focus is on expanding your toolkit of problem-solving techniques and considering new settings that model real-world challenges. Topics may include: randomization, approximation algorithms, online and streaming settings, parallel and distributed computing, linear programming and LP rounding, optimization under uncertainty, bias and fairness in algorithms, and the algorithmic foundations of data science, machine learning, and operations research."
CS 333,Natural Language Processing,MM,False,"Natural Language Processing (NLP) is the subfield of CS that focuses on language technology. Because language is one of the most complex human abilities, building computational technologies that involve language is both challenging and important. This course introduces NLP methods and applications. Students will (1) learn core NLP algorithms and models; (2) explore the challenges posed by different aspects of human language; (3) learn to evaluate ethical concerns about language technology; and (4) complete a series of projects to implement and improve NLP models. We will cover a range of techniques, including n-gram models, Bayesian classifiers, neural networks, and deep learning. Applications include parsing, sentiment analysis, machine translation, and language generation, as well as information retrieval tasks like summarization, topic modeling, and question-answering."
CS 334,Sem: Methods for Ethics of Tech,REP,False,"How do we educate the next generation of data scientists and software engineers to think of their work as not just technical but also ethical? How do we get them to see that the social impact of their work requires that it be driven by sound ethical principles? The way that these questions are interrogated, discussed, and the sort of answers we might propose will be informed by a thoroughgoing interdisciplinary lens. Students will learn theoretical frameworks from both Philosophy and Computational and Data Sciences and work together to see how knowledge of frameworks from both disciplines serves to enrich our understanding of the ethical issues that face digital technologies, as well as empower us to find creative solutions. Central questions include: What kinds of ethical considerations are part of the everyday jobs of graduates working in digital technology, either in non-profit or for-profit organizations? What parts of the current liberal arts curriculum, if any, are preparing our graduates for the kinds of ethical decision-making they need to engage in? How to expand the reach of ethical reasoning within the liberal arts curriculum, in order to strengthen the ethical decision-making preparation? A key component in our collective efforts to engage with these questions will involve a sustained semester-long research project with Wellesley alums working in the field of digital tech."
CS 340,Modeling for Computer Systems,MM,False,"This course focuses on modeling and specifying computer systems. Students will learn how to reason about the properties and expected behavior of modern software. Topics include designing specifications, property-based testing, model checking, and satisfiability solvers. We will use real-world case studies to motivate the analysis of reliable computer systems. By the end of the course, students will be able to (1) design specifications for the expected behavior of a system, (2) model system behavior using state-of-the-art tools with automated formal methods, and (3) identify and prevent software bugs. While prior experience with algorithm design and analysis is expected, the course will cover any necessary background in systems programming and formal methods."
CS 342,Computer Security,MM,False,"An introduction to computer security. Topics include the security mindset, authentication, access control, operating system security (with a focus on Linux), cryptography, security protocols, software security, network security, usable security, privacy, social engineering, and the ethics of hacking. This course will emphasize hands-on experience with technical topics and the ability to communicate security and privacy topics to lay and expert audiences. Assignments will include technical exercises exploring security exploits and tools in a Linux environment; problem sets including exercises and proofs related to theoretical aspects of computer security; and opportunities to research, write, present, and lead discussions on security-related topics."
CS 343,Distributed Computing,MM,False,"This course is for students interested in understanding the fundamental concepts and algorithms underlying existing distributed systems. By the end of this course, students will have the knowledge needed to work with and build distributed systems, such as distributed file systems, peer-to-peer systems, and cloud computing systems. Topics discussed include MapReduce, distributed file systems, distributed coordination algorithms, consensus, fault-tolerance, and security."
CS 344,Deep learning,MM,False,"Deep learning is the study of how computers can learn from data in a manner inspired by neural connections in the human brain. It is revolutionizing how people and machines interact. This course explores the principles and practice of modern deep learning systems. Students will design and implement their own artificial neural networks as well as analyze massive deep learning models at the forefront of the field of machine learning. Deep learning algorithms such as convolutional neural networks and recurrent neural networks will be applied in a variety of domains, including medical diagnosis, self-driving cars, and large-language models. Students will further investigate the societal impacts and ethical considerations of these deep learning systems."
CS 345,Probabilistic Foundations of Machine Learning,MM,False,"In recent years, Machine Learning has enabled applications that were previously not thought possible—from systems that propose novel drugs or generate new art/music, to systems that accurately and reliably predict outcomes of medical interventions in real-time. But what has enabled these developments? Faster computing hardware, large amounts of data, and the Probabilistic paradigm of Machine Learning (ML), a paradigm that casts recent advances in ML, like neural networks, into a statistical learning framework. In this course, we introduce the foundational concepts behind this paradigm—statistical model specification, and statistical learning and inference—focusing on connecting theory with real-world applications and hands-on practice. While expanding our methodological toolkit, we will simultaneously introduce critical perspectives to examine the ethics of ML within sociotechnical systems. This course lays the foundation for advanced study and research in ML. Topics include: directed graphical models, deep Bayesian regression/classification, generative models (latent variable models) for clustering, dimensionality reduction, and time-series forecasting. Students will get hands-on experience building models for specific tasks, most taken from healthcare contexts, using NumPyro, a Python-based probabilistic programming language."
CS 349,Advanced Topics in Computer Science,MM,False,""
CS 365,Advanced Projects in Playable Media,MM,False,"Students with a deep personal interest in digital game design and other forms of playable media will work in collaborative units to explore all aspects of the game development process while contributing to a semester-length project of their own devising. This course will require students to explore an ethical approach to game development that will introduce new practices for ideation, pitching, designing, playtesting, and versioning through an iterative process that will result in a finished game. This course is specifically designed for students who have moderate experience with game development through either curricular activities or by working on projects of their own. Students will be expected to have moderate levels of experience with the Unity Game Engine."
CS 366,Advanced Projects in Interactive Media,MM,False,"Students with deep interest in interactive media will drive cutting-edge research that shapes and examines novel user experiences with technology. Students will work in small groups to identify a direction of research, explore and iterate over designs, prototype at varying fidelities, build working systems, consider ethical implications, conduct evaluative studies, and report findings. This course is designed for students who have experience in designing and implementing interactive media through either curricular activities or by working on projects. Students will be expected to have moderate levels of experience with front-end web development."